{
  "operation_id": "OPS-001",
  "business_id": "biz_akosmicanimals",
  "title": "Launch summer collection landing page",
  "status": "completed",
  "outcome": "Landing page deployed with 95% Lighthouse score",
  "outcome_classification": "success",
  "operation_date": "2026-08",
  "decision_id": "DEC-002",
  "recommendation_id": "rec_bot_001",
  "review_id": "review_2026-08-01T00:00:00+00:00",
  "sop_id": "copywriting/content-review",
  "owner": "Founder",
  "created_at": "2026-08-01T09:00:00Z",
  "updated_at": "2026-08-03T10:00:00Z"
}
